{
  "$schema": "./ai-bots.schema.json",
  "name": "CodoSEO AI bot registry",
  "version": 2,
  "updated": "2026-10-11",
  "license": "CC0-1.0",
  "homepage": "https://codoseo.com/ai-bots",
  "bots": [
    {
      "token": "GPTBot",
      "operator": "OpenAI",
      "product": "GPTBot",
      "purpose": "training",
      "honours_robots": "yes",
      "crawls": true,
      "user_agent_contains": "GPTBot",
      "user_agent": null,
      "ip_ranges_url": "https://openai.com/gptbot.json",
      "reverse_dns": [],
      "signature_agent": null,
      "source_url": "https://developers.openai.com/api/docs/bots",
      "last_reviewed": "2026-10-09",
      "notes": "Used to train OpenAI's generative AI foundation models."
    },
    {
      "token": "OAI-SearchBot",
      "operator": "OpenAI",
      "product": "ChatGPT search",
      "purpose": "search",
      "honours_robots": "yes",
      "crawls": true,
      "user_agent_contains": "OAI-SearchBot",
      "user_agent": "Mozilla/5.0 (Macintosh; Intel Mac OS X 10_15_7) AppleWebKit/537.36 (KHTML, like Gecko) Chrome/131.0.0.0 Safari/537.36; compatible; OAI-SearchBot/1.4; +https://openai.com/searchbot",
      "ip_ranges_url": "https://openai.com/searchbot.json",
      "reverse_dns": [],
      "signature_agent": null,
      "source_url": "https://developers.openai.com/api/docs/bots",
      "last_reviewed": "2026-10-11",
      "notes": "Blocking it removes the site from ChatGPT search answers; changes take about 24 hours."
    },
    {
      "token": "ChatGPT-User",
      "operator": "OpenAI",
      "product": "ChatGPT and Custom GPTs",
      "purpose": "user_fetch",
      "honours_robots": "partial",
      "crawls": true,
      "user_agent_contains": "ChatGPT-User",
      "user_agent": "Mozilla/5.0 AppleWebKit/537.36 (KHTML, like Gecko); compatible; ChatGPT-User/1.0; +https://openai.com/bot",
      "ip_ranges_url": "https://openai.com/chatgpt-user.json",
      "reverse_dns": [],
      "signature_agent": null,
      "source_url": "https://developers.openai.com/api/docs/bots",
      "last_reviewed": "2026-10-11",
      "notes": "User-initiated, so robots.txt rules may not apply."
    },
    {
      "token": "OAI-AdsBot",
      "operator": "OpenAI",
      "product": "ChatGPT ads",
      "purpose": "ads",
      "honours_robots": "unknown",
      "crawls": true,
      "user_agent_contains": "OAI-AdsBot",
      "user_agent": null,
      "ip_ranges_url": "https://openai.com/adsbot.json",
      "reverse_dns": [],
      "signature_agent": null,
      "source_url": "https://developers.openai.com/api/docs/bots",
      "last_reviewed": "2026-10-09",
      "notes": "Checks pages submitted as ChatGPT ads; the documentation does not state its robots.txt behaviour."
    },
    {
      "token": "ClaudeBot",
      "operator": "Anthropic",
      "product": "Claude training",
      "purpose": "training",
      "honours_robots": "yes",
      "crawls": true,
      "user_agent_contains": "ClaudeBot",
      "user_agent": null,
      "ip_ranges_url": "https://claude.com/crawling/bots.json",
      "reverse_dns": [],
      "signature_agent": null,
      "source_url": "https://support.claude.com/en/articles/8896518-does-anthropic-crawl-data-from-the-web-and-how-can-site-owners-block-the-crawler",
      "last_reviewed": "2026-10-09",
      "notes": "Collects web content for model training; also honours Crawl-delay."
    },
    {
      "token": "Claude-SearchBot",
      "operator": "Anthropic",
      "product": "Claude search",
      "purpose": "search",
      "honours_robots": "yes",
      "crawls": true,
      "user_agent_contains": "Claude-SearchBot",
      "user_agent": null,
      "ip_ranges_url": "https://claude.com/crawling/bots.json",
      "reverse_dns": [],
      "signature_agent": null,
      "source_url": "https://support.claude.com/en/articles/8896518-does-anthropic-crawl-data-from-the-web-and-how-can-site-owners-block-the-crawler",
      "last_reviewed": "2026-10-11",
      "notes": "Improves Claude search result quality; blocking it can reduce visibility in Claude search."
    },
    {
      "token": "Claude-User",
      "operator": "Anthropic",
      "product": "Claude user fetch",
      "purpose": "user_fetch",
      "honours_robots": "yes",
      "crawls": true,
      "user_agent_contains": "Claude-User",
      "user_agent": null,
      "ip_ranges_url": "https://claude.com/crawling/bots.json",
      "reverse_dns": [],
      "signature_agent": null,
      "source_url": "https://support.claude.com/en/articles/8896518-does-anthropic-crawl-data-from-the-web-and-how-can-site-owners-block-the-crawler",
      "last_reviewed": "2026-10-11",
      "notes": "Fetches pages when a user asks Claude; honours robots.txt, unlike most user-triggered fetchers."
    },
    {
      "token": "PerplexityBot",
      "operator": "Perplexity",
      "product": "Perplexity search",
      "purpose": "search",
      "honours_robots": "yes",
      "crawls": true,
      "user_agent_contains": "PerplexityBot",
      "user_agent": "Mozilla/5.0 AppleWebKit/537.36 (KHTML, like Gecko; compatible; PerplexityBot/1.0; +https://perplexity.ai/perplexitybot)",
      "ip_ranges_url": "https://www.perplexity.com/perplexitybot.json",
      "reverse_dns": [],
      "signature_agent": null,
      "source_url": "https://docs.perplexity.ai/guides/bots",
      "last_reviewed": "2026-10-11",
      "notes": "Surfaces and links sites in Perplexity search results."
    },
    {
      "token": "Perplexity-User",
      "operator": "Perplexity",
      "product": "Perplexity user fetch",
      "purpose": "user_fetch",
      "honours_robots": "no",
      "crawls": true,
      "user_agent_contains": "Perplexity-User",
      "user_agent": "Mozilla/5.0 AppleWebKit/537.36 (KHTML, like Gecko; compatible; Perplexity-User/1.0; +https://perplexity.ai/perplexity-user)",
      "ip_ranges_url": "https://www.perplexity.com/perplexity-user.json",
      "reverse_dns": [],
      "signature_agent": null,
      "source_url": "https://docs.perplexity.ai/guides/bots",
      "last_reviewed": "2026-10-11",
      "notes": "Since a user requested the fetch, this fetcher generally ignores robots.txt rules."
    },
    {
      "token": "Googlebot",
      "operator": "Google",
      "product": "Google Search",
      "purpose": "search",
      "honours_robots": "yes",
      "crawls": true,
      "user_agent_contains": "Googlebot",
      "user_agent": null,
      "ip_ranges_url": "https://developers.google.com/static/crawling/ipranges/common-crawlers.json",
      "reverse_dns": [
        "googlebot.com",
        "google.com",
        "googleusercontent.com"
      ],
      "signature_agent": null,
      "source_url": "https://developers.google.com/crawling/docs/crawlers-fetchers/google-common-crawlers",
      "last_reviewed": "2026-10-09",
      "notes": "Google's search crawler."
    },
    {
      "token": "Google-Extended",
      "operator": "Google",
      "product": "Gemini training and grounding",
      "purpose": "training",
      "honours_robots": "yes",
      "crawls": false,
      "user_agent_contains": null,
      "user_agent": null,
      "ip_ranges_url": null,
      "reverse_dns": [],
      "signature_agent": null,
      "source_url": "https://developers.google.com/crawling/docs/crawlers-fetchers/google-common-crawlers",
      "last_reviewed": "2026-10-09",
      "notes": "Control token only, with no user agent of its own; governs Gemini training and grounding and does not affect Search or AI Overviews."
    },
    {
      "token": "Google-Agent",
      "operator": "Google",
      "product": "Project Mariner agents",
      "purpose": "agent",
      "honours_robots": "no",
      "crawls": true,
      "user_agent_contains": "Google-Agent",
      "user_agent": null,
      "ip_ranges_url": "https://developers.google.com/static/crawling/ipranges/user-triggered-agents.json",
      "reverse_dns": [
        "google.com",
        "googleusercontent.com"
      ],
      "signature_agent": "https://agent.bot.goog",
      "source_url": "https://developers.google.com/crawling/docs/crawlers-fetchers/google-agent",
      "last_reviewed": "2026-10-09",
      "notes": "User-triggered agent on Google infrastructure; generally ignores robots.txt and is verified by IP list or Web Bot Auth."
    },
    {
      "token": "Applebot",
      "operator": "Apple",
      "product": "Spotlight, Siri and Safari search",
      "purpose": "search",
      "honours_robots": "yes",
      "crawls": true,
      "user_agent_contains": "Applebot",
      "user_agent": null,
      "ip_ranges_url": "https://search.developer.apple.com/applebot.json",
      "reverse_dns": [
        "applebot.apple.com"
      ],
      "signature_agent": null,
      "source_url": "https://support.apple.com/en-us/119829",
      "last_reviewed": "2026-10-09",
      "notes": "Crawls for Apple search features; its data may also be used to train Apple foundation models.",
      "robots_fallback": "Googlebot"
    },
    {
      "token": "Applebot-Extended",
      "operator": "Apple",
      "product": "Apple foundation model training",
      "purpose": "training",
      "honours_robots": "yes",
      "crawls": false,
      "user_agent_contains": null,
      "user_agent": null,
      "ip_ranges_url": null,
      "reverse_dns": [],
      "signature_agent": null,
      "source_url": "https://support.apple.com/en-us/119829",
      "last_reviewed": "2026-10-09",
      "notes": "Does not crawl; a usage-permission token for Apple model training only."
    },
    {
      "token": "meta-externalagent",
      "operator": "Meta",
      "product": "Meta AI model training",
      "purpose": "training",
      "honours_robots": "yes",
      "crawls": true,
      "user_agent_contains": "meta-externalagent",
      "user_agent": null,
      "ip_ranges_url": null,
      "reverse_dns": [],
      "signature_agent": null,
      "source_url": "https://developers.facebook.com/docs/sharing/webmasters/web-crawlers",